{
  "$schema": "http://json-schema.org/draft-04/schema#",
  "title": "Retrieve additional information for a user's business details",
  "description": "Retrieve business details response",
  "type": "object",
  "properties": {
    "businessId": {
      "type": "string",
      "description": "A unique identifier for the business income source. Previously known as selfEmploymentId.",
      "example": "XAIS12345678910",
      "pattern": "^X[a-zA-Z0-9]{1}IS[0-9]{11}$"
    },
    "typeOfBusiness": {
      "type": "string",
      "description": "The type of business income source.",
      "enum": [
        "self-employment",
        "uk-property",
        "foreign-property",
        "property-unspecified"
      ],
      "example": "self-employment"
    },
    "tradingType": {
      "type": "string",
      "description": "The type of trading carried out by the business.",
      "example": "Plastering",
      "minLength": 1,
      "maxLength": 35
    },
    "tradingName": {
      "type": "string",
      "description": "The trading name of the business.",
      "example": "ABC Ltd.",
      "maxLength": 105
    },
    "firstAccountingPeriodStartDate": {
      "type": "string",
      "description": "The first accounting period start date. Must conform to the format `YYYY-MM-DD`\n\nNote: <b>Accounting period start and end dates should not be displayed to users of your software.</b>",
      "format": "date",
      "example": "2019-09-30"
    },
    "firstAccountingPeriodEndDate": {
      "type": "string",
      "description": "The first accounting period end date. Must conform to the format `YYYY-MM-DD`\n\nNote: <b>Accounting period start and end dates should not be displayed to users of your software.</b>",
      "format": "date",
      "example": "2020-02-29"
    },
    "latencyDetails": {
      "type": "object",
      "description": "Income source latency details.",
      "properties": {
        "latencyEndDate": {
          "type": "string",
          "description": "End date of latency period for the income source. Must conform to the format `YYYY-MM-DD`",
          "example": "2020-02-27",
          "format": "date"
        },
        "taxYear1": {
          "type": "string",
          "description": "First tax year for the income source.",
          "example": "2018-19",
          "format": "YYYY-YY",
          "minLength": 7,
          "maxLength": 7
        },
        "latencyIndicator1": {
          "type": "string",
          "description": "'A' indicates latency applies for the specified tax year. 'Q' indicates latency does not apply for the specified tax year.",
          "enum": [
            "A",
            "Q"
          ],
          "example": "A"
        },
        "taxYear2": {
          "type": "string",
          "description": "Second tax year for the income source.",
          "example": "2019-20",
          "format": "YYYY-YY",
          "minLength": 7,
          "maxLength": 7
        },
        "latencyIndicator2": {
          "type": "string",
          "description": "'A' indicates latency applies for the specified tax year. 'Q' indicates latency does not apply for the specified tax year.",
          "enum": [
            "A",
            "Q"
          ],
          "example": "A"
        }
      },
      "required": [
        "latencyEndDate",
        "taxYear1",
        "latencyIndicator1",
        "taxYear2",
        "latencyIndicator2"
      ],
      "additionalProperties": false
    },
    "quarterlyTypeChoice": {
      "type": "object",
      "description": "Quarterly reporting period type.",
      "properties": {
        "quarterlyPeriodType": {
          "type": "string",
          "enum": [
            "standard",
            "calendar"
          ],
          "description": "The quarterly period type that is being chosen for the business ID. For standard quarters, `quarterlyTypeChoice` is only returned when the customer has previously selected calendar quarters, and then switched back to standard.",
          "example": "calendar"
        },
        "taxYearOfChoice": {
          "type": "string",
          "description": "The tax year for which the quarterly period type was chosen.",
          "pattern": "^2[0-9]{3}-[0-9]{2}$",
          "example": "2023-24"
        }
      },
      "required": [
        "quarterlyPeriodType",
        "taxYearOfChoice"
      ],
      "additionalProperties": false
    },
    "accountingPeriods": {
      "type": "array",
      "description": "The start and end dates of the latest accounting period for the business. This array contains dates for the latest accounting period only.\n\nNote: <b>Accounting period start and end dates should not be displayed to users of your software.</b>",
      "items": {
        "type": "object",
        "properties": {
          "start": {
            "description": "Date your books or accounts start - the beginning of your accounting period. Must conform to the format `YYYY-MM-DD`",
            "type": "string",
            "format": "date",
            "example": "2018-04-06"
          },
          "end": {
            "description": "Date your books or accounts are made up to - the end of your accounting period. Must conform to the format `YYYY-MM-DD`",
            "type": "string",
            "format": "date",
            "example": "2019-04-05"
          }
        },
        "required": [
          "start",
          "end"
        ],
        "additionalProperties": false
      }
    },
    "commencementDate": {
      "description": "Business start date, must be in the past. Must conform to the format `YYYY-MM-DD`",
      "type": "string",
      "format": "date",
      "example": "2016-09-24"
    },
    "cessationDate": {
      "description": "Business cessation date. Must conform to the format `YYYY-MM-DD`",
      "type": "string",
      "format": "date",
      "example": "2020-03-24"
    },
    "businessAddressLineOne": {
      "description": "First line of the business address.",
      "type": "string",
      "minLength": 1,
      "maxLength": 35,
      "example": "1 ABC Rd."
    },
    "businessAddressLineTwo": {
      "description": "Second line of the business address.",
      "type": "string",
      "minLength": 1,
      "maxLength": 35,
      "example": "London"
    },
    "businessAddressLineThree": {
      "description": "Third line of the business address.",
      "type": "string",
      "minLength": 1,
      "maxLength": 35,
      "example": "Greater London"
    },
    "businessAddressLineFour": {
      "description": "Fourth line of the business address.",
      "type": "string",
      "minLength": 1,
      "maxLength": 35,
      "example": "United Kingdom"
    },
    "businessAddressPostcode": {
      "description": "Business postcode.",
      "type": "string",
      "minLength": 1,
      "maxLength": 10,
      "example": "M1 1AG"
    },
    "businessAddressCountryCode": {
      "description": "ISO country code for the business if it is in a non-GB country. The two-letter code for a country must adhere to ISO 3166.",
      "type": "string",
      "example": "FR"
    }
  },
  "required": [
    "businessId",
    "typeOfBusiness"
  ],
  "additionalProperties": false
}
